{
  "schema_version": "1.0",
  "iteration": 129,
  "date": "2026-03-05T12:00:00Z",
  "mode": "multi_task",
  "validation": {
    "last_commit_hash": "cfd71f3d0801a48bf0d9bbe55e62b4b8a7c7eeaf",
    "last_commit_valid": true,
    "compilation_status": "passing",
    "revert_needed": false,
    "revert_reason": null
  },
  "tasks": [
    {
      "slot": 1,
      "id": "#BUG-042",
      "description": "Fix PDF Cost Summary to include tool costs in step/section/workspace totals. Add stepTools field to ExportPdfOptions, pass step-tool associations from canvas-view.tsx, and sum tool cost_per_month into computeStepMonthlyCost().",
      "source": "prd/BUGS.md",
      "type": "fix",
      "phase": "Phase 3b: Tools Canvas + Enhanced Export",
      "complexity": "M",
      "attempts": 1,
      "risk_score": 2,
      "acceptance_criteria": [
        "ExportPdfOptions interface has an optional stepTools field typed as an array of { step_id: string; tool: { cost_per_month: number | null } }",
        "computeStepMonthlyCost() sums tool cost_per_month values for the step in addition to labor cost",
        "canvas-view.tsx handleEnhancedExportPdf fetches stepTools (via fetchStepToolsByStep or batch) and passes them to createWorkspacePdf when config.costAnalysis is enabled",
        "PDF Cost Summary section totals now include tool costs (step total = labor + tool monthly cost)",
        "Section rollup totals include tool costs",
        "Workspace total cost includes tool costs",
        "Steps with zero labor cost but non-zero tool cost still appear in cost table",
        "TypeScript compiles with zero errors (npx tsc --noEmit)"
      ],
      "files_owned": [
        "src/lib/export/pdf.ts",
        "src/app/(app)/w/[workspaceId]/[tabId]/canvas-view.tsx"
      ],
      "files_read_only": [
        "src/types/database.ts",
        "src/lib/api/client.ts",
        "src/components/panels/step-detail-panel.tsx"
      ],
      "context": {
        "similar_files": ["src/components/panels/step-detail-panel.tsx lines 500-520 — UI combined cost calculation pattern"],
        "patterns_to_follow": [
          "step-detail-panel.tsx: stepTools.reduce((sum, st) => sum + (st.tool.cost_per_month ?? 0), 0) — same pattern for tool cost aggregation",
          "fetchStepToolsByStep(stepId) in client.ts returns StepToolWithTool[] with tool.cost_per_month",
          "ExportPdfOptions already has optional stepRoles — follow same pattern for stepTools"
        ],
        "learnings_relevant": [
          "apiFetch unwraps envelope — fetchStepToolsByStep returns StepToolWithTool[] directly",
          "BUG-035: step-tools API returns 500 when migration 024 not pushed — but code should still compile and work structurally"
        ],
        "affected_urls": []
      },
      "has_ui_changes": false,
      "has_data_model_changes": false,
      "special_instructions": "The step-tools API may return 500 if migration 024 isn't pushed (BUG-035). The fix is still correct structurally — it handles empty/failed fetch gracefully. Use the existing StepToolWithTool type from database.ts. For batch fetching all step tools, consider fetching once for all steps in the workspace (similar to how stepRoles are fetched) rather than N+1 per-step fetches. Check if a workspace-level step-tools endpoint exists; if not, fetch per-step or add a simple loop. The cost filter condition in the Cost Summary (totalMonthlyHours > 0 || totalMonthlyCost > 0) should naturally include tool-only costs now."
    },
    {
      "slot": 2,
      "id": "#IMP-100",
      "description": "Add empty state guidance to tools canvas when no tools exist. Show centered prompt like 'Add your first tool to start tracking your tech stack' with a pointer to the toolbar Add button.",
      "source": "prd/IMPROVEMENTS.md",
      "type": "improve",
      "phase": "Phase 3b: Tools Canvas + Enhanced Export",
      "complexity": "S",
      "attempts": 1,
      "risk_score": 0,
      "acceptance_criteria": [
        "When tools array is empty, a centered empty state message is visible on the tools canvas",
        "Message text guides user to add their first tool",
        "Message disappears when tools are added",
        "Styling follows dark theme conventions (text-white/55 or text-white/30 for secondary text)",
        "TypeScript compiles with zero errors"
      ],
      "files_owned": [
        "src/app/(app)/w/[workspaceId]/tools/tools-canvas-view.tsx"
      ],
      "files_read_only": [],
      "context": {
        "similar_files": ["src/app/(app)/w/[workspaceId]/[tabId]/canvas-view.tsx — existing empty state patterns"],
        "patterns_to_follow": ["Dark theme empty state: centered div with text-white/55 heading, text-white/30 body"],
        "learnings_relevant": [],
        "affected_urls": ["/w/[workspaceId]/tools"]
      },
      "has_ui_changes": true,
      "has_data_model_changes": false,
      "special_instructions": "Simple overlay or conditional render. Check how the existing canvas-view.tsx handles empty state for reference."
    },
    {
      "slot": 3,
      "id": "#IMP-094",
      "description": "Add tooltips to disabled export dialog sections explaining what data is needed to enable them (e.g., 'Requires journey tab', 'Requires improvement ideas').",
      "source": "prd/IMPROVEMENTS.md",
      "type": "improve",
      "phase": "Phase 3b: Tools Canvas + Enhanced Export",
      "complexity": "S",
      "attempts": 1,
      "risk_score": 0,
      "acceptance_criteria": [
        "Disabled checkboxes in export dialog show a tooltip on hover explaining the prerequisite",
        "Tooltip text is contextual per section (e.g., 'Add a journey tab to enable' for journey sections)",
        "Tooltips only appear on disabled sections, not enabled ones",
        "Uses Radix Tooltip or native title attribute (match existing pattern)",
        "TypeScript compiles with zero errors"
      ],
      "files_owned": [
        "src/components/panels/export-pdf-dialog.tsx"
      ],
      "files_read_only": [],
      "context": {
        "similar_files": [],
        "patterns_to_follow": ["Radix Tooltip already imported in other components — check if available in export-pdf-dialog.tsx"],
        "learnings_relevant": [],
        "affected_urls": []
      },
      "has_ui_changes": true,
      "has_data_model_changes": false,
      "special_instructions": "SECTION_GROUPS has an 'available' field per section and a 'disabledReason' or similar could be added. Simplest approach: add a 'disabledTooltip' string to each section group item, then render as title attribute on the label when disabled. Radix Tooltip is fine too if already used in the file."
    }
  ],
  "shared_files": {
    "read_only": ["package.json", "tsconfig.json", "src/types/database.ts", "src/lib/api/client.ts"],
    "owner": null,
    "note": "No shared file modifications needed. database.ts types and client.ts functions are read-only references."
  },
  "merge_order": ["#BUG-042", "#IMP-100", "#IMP-094"],
  "testing_plan": {
    "run_acceptance": true,
    "run_regression": false,
    "regression_reason": "Last regression was iteration 128 (1 iteration ago). BUG-042 fix is contained to PDF export logic. No regression needed this iteration.",
    "suites_to_run": ["acceptance"],
    "cadence_trigger": null
  },
  "status_updates": {
    "warnings_added": [],
    "diagnoses_written": false,
    "signal_override": null
  }
}
